"mât"," mât EDF",,,,,,"Sonic 1",,,,,,,,,,,,,,"Sonic 2",,,,,,,,,,,,,,"Sonic 3",,,,,,,,,,,,,,"LIDAR",,,,,,,,"A1",,,,"A2",,,,"A3",,,,"A4",,,,"A5",,,
"capteur","Température de l’air","Direction du vent","Vitesse du vent","Hygrométrie relative","Pluviométrie","Pression atmosphérique","Moyenne de la vitesse du vent","Écart-type de la vitesse du vent","Moyenne et écart-type de la température","Moyenne et écart-type de la direction du vent","Vitesse du vent","Covariances des vitesses de vent et de la température ","Énergie cinétique turbulente ","Température virtuelle","Vitesse de frottement","Flux d'énergie reçue par le sol","Rapport de la hauteur de mesure et de la longueur de Monin Obukhov","Hauteur de rugosité","Gradients verticaux de température, de vent et de célérité du son","Complétude des données","Moyenne de la vitesse du vent","Écart-type de la vitesse du vent","Moyenne et écart-type de la température","Moyenne et écart-type de la direction du vent","Vitesse du vent","Covariances des vitesses de vent et de la température ","Énergie cinétique turbulente ","Température virtuelle","Vitesse de frottement","Flux d'énergie reçue par le sol","Rapport de la hauteur de mesure et de la longueur de Monin Obukhov","Hauteur de rugosité","Gradients verticaux de température, de vent et de célérité du son","Complétude des données","Moyenne de la vitesse du vent","Écart-type de la vitesse du vent","Moyenne et écart-type de la température","Moyenne et écart-type de la direction du vent","Vitesse du vent","Covariances des vitesses de vent et de la température ","Énergie cinétique turbulente ","Température virtuelle","Vitesse de frottement","Flux d'énergie reçue par le sol","Rapport de la hauteur de mesure et de la longueur de Monin Obukhov","Hauteur de rugosité","Gradients verticaux de température, de vent et de célérité du son","Complétude des données","Température","Humidité relative","Pression atmosphérique","Pluviométrie","Brouillard","Vitesse du vent dans le plan horizontal","Vitesse du vent dans le plan vertical","Direction du vent","Niveau sonore équivalent","Niveau sonore dépassé 10 % du temps","Niveau sonore dépassé 50 % du temps","Niveau sonore dépassé 90 % du temps","Niveau sonore équivalent","Niveau sonore dépassé 10 % du temps","Niveau sonore dépassé 50 % du temps","Niveau sonore dépassé 90 % du temps","Niveau sonore équivalent","Niveau sonore dépassé 10 % du temps","Niveau sonore dépassé 50 % du temps","Niveau sonore dépassé 90 % du temps","Niveau sonore équivalent","Niveau sonore dépassé 10 % du temps","Niveau sonore dépassé 50 % du temps","Niveau sonore dépassé 90 % du temps","Niveau sonore équivalent","Niveau sonore dépassé 10 % du temps","Niveau sonore dépassé 50 % du temps","Niveau sonore dépassé 90 % du temps"
"référence","MAT_TEMP_6M, MAT_TEMP_20M, MAT_TEMP_60M, MAT_TEMP_78M","MAT_WIND_DIR_70M, MAT_WIND_DIR_80M","MAT_WIND_SPEED_35M, MAT_WIND_SPEED_75M, MAT_WIND_SPEED_80M","MAT_RH_6M, MAT_RH_20M, MAT_RH_60M, MAT_RH_78M","MAT_RAIN","MAT_PATM","S1_MOY_U, S1_MOY_V, S1_MOY_W","S1_STD_U, S1_STD_V, S1_STD_W","S1_MOY_T, S1_STD_T","S1_WIND_DIR, S1_STD_WIND_DIR","S1_WIND_SPEED","S1_UW, S1_VW, S1_WT","S1_TKE","S1_T_STAR","S1_U_STAR","S1_H","S1_ZsurLMO","S1_ZO","S1_GRAD_T, S1_GRAD_W, S1_GRAD_C","S1_COMPLETENESS","S2_MOY_U, S2_MOY_V, S2_MOY_W","S2_STD_U, S2_STD_V, S2_STD_W","S2_MOY_T, S2_STD_T","S2_WIND_DIR, S2_STD_WIND_DIR","S2_WIND_SPEED","S2_UW, S2_VW, S2_WT","S2_TKE","S2_T_STAR","S2_U_STAR","S2_H","S2_ZsurLMO","S2_ZO","S2_GRAD_T, S2_GRAD_W, S2_GRAD_C","S2_COMPLETENESS","S3_MOY_U, S3_MOY_V, S3_MOY_W","S3_STD_U, S3_STD_V, S3_STD_W","S3_MOY_T, S3_STD_T","S3_WIND_DIR, S3_STD_WIND_DIR","S3_WIND_SPEED","S3_UW, S3_VW, S3_WT","S3_TKE","S3_T_STAR","S3_U_STAR","S3_H","S3_ZsurLMO","S3_ZO","S3_GRAD_T, S3_GRAD_W, S3_GRAD_C","S3_COMPLETENESS","LID_TEMP","LID_HUM","LID_PATM","LID_RAIN","LID_FOG ","LID_WIND_HORIZ_SPEED_10M, LID_WIND_HORIZ_SPEED_19M, LID_WIND_HORIZ_SPEED_38M, LID_WIND_HORIZ_SPEED_39M, LID_WIND_HORIZ_SPEED_54M, LID_WIND_HORIZ_SPEED_69M, LID_WIND_HORIZ_SPEED_84M, LID_WIND_HORIZ_SPEED_99M, LID_WIND_HORIZ_SPEED_114M, LID_WIND_HORIZ_SPEED_129M, LID_WIND_HORIZ_SPEED_144M, LID_WIND_HORIZ_SPEED_164M, LID_WIND_HORIZ_SPEED_184M","LID_WIND_VERT_SPEED_10M, LID_WIND_VERT_SPEED_19M, LID_WIND_VERT_SPEED_38M, LID_WIND_VERT_SPEED_39M, LID_WIND_VERT_SPEED_54M, LID_WIND_VERT_SPEED_69M, LID_WIND_VERT_SPEED_84M, LID_WIND_VERT_SPEED_99M, LID_WIND_VERT_SPEED_114M, LID_WIND_VERT_SPEED_129M, LID_WIND_VERT_SPEED_144M, LID_WIND_VERT_SPEED_164M, LID_WIND_WIND_VERT_SPEED_184M","LID_WIND_WIND_DIR_SPEED_10M, LID_WIND_WIND_DIR_SPEED_19M, LID_WIND_WIND_DIR_SPEED_38M, LID_WIND_WIND_DIR_SPEED_39M, LID_WIND_WIND_DIR_SPEED_54M, LID_WIND_WIND_DIR_SPEED_69M, LID_WIND_WIND_DIR_SPEED_84M, LID_WIND_WIND_DIR_SPEED_99M, LID_WIND_WIND_DIR_SPEED_114M, LID_WIND_WIND_DIR_SPEED_129M, LID_WIND_WIND_DIR_SPEED_144M, LID_WIND_WIND_DIR_SPEED_164M, LID_WIND_WIND_DIR_SPEED_184M","A1_LEQ_Z, A1_LEQ_A, A1_LEQ_6.3_Hz, A1_LEQ_8_Hz, A1_LEQ_10_Hz, A1_LEQ_12.5_Hz, A1_LEQ_16_Hz, A1_LEQ_20_Hz, A1_LEQ_25_Hz, A1_LEQ_31.5_Hz, A1_LEQ_40_Hz, A1_LEQ_50_Hz, A1_LEQ_63_Hz, A1_LEQ_80_Hz, A1_LEQ_100_Hz, A1_LEQ_125_Hz, A1_LEQ_160_Hz, A1_LEQ_200_Hz, A1_LEQ_250_Hz, A1_LEQ_315_Hz, A1_LEQ_400_Hz, A1_LEQ_500_Hz, A1_LEQ_630_Hz, A1_LEQ_800_Hz, A1_LEQ_1000_Hz, A1_LEQ_1250_Hz, A1_LEQ_1600_Hz, A1_LEQ_2000_Hz, A1_LEQ_2500_Hz, A1_LEQ_3150_Hz, A1_LEQ_4000_Hz, A1_LEQ_5000_Hz, A1_LEQ_6300_Hz, A1_LEQ_8000_Hz, A1_LEQ_10000_Hz, A1_LEQ_12500_Hz, A1_LEQ_16000_Hz, A1_LEQ_20000_Hz","A1_L10_Z, A1_L10_A, A1_L10_6.3_Hz, A1_L10_8_Hz, A1_L10_10_Hz, A1_L10_12.5_Hz, A1_L10_16_Hz, A1_L10_20_Hz, A1_L10_25_Hz, A1_L10_31.5_Hz, A1_L10_40_Hz, A1_L10_50_Hz, A1_L10_63_Hz, A1_L10_80_Hz, A1_L10_100_Hz, A1_L10_125_Hz, A1_L10_160_Hz, A1_L10_200_Hz, A1_L10_250_Hz, A1_L10_315_Hz, A1_L10_400_Hz, A1_L10_500_Hz, A1_L10_630_Hz, A1_L10_800_Hz, A1_L10_1000_Hz, A1_L10_1250_Hz, A1_L10_1600_Hz, A1_L10_2000_Hz, A1_L10_2500_Hz, A1_L10_3150_Hz, A1_L10_4000_Hz, A1_L10_5000_Hz, A1_L10_6300_Hz, A1_L10_8000_Hz, A1_L10_10000_Hz, A1_L10_12500_Hz, A1_L10_16000_Hz, A1_L10_20000_Hz","A1_L50_Z, A1_L50_A, A1_L50_6.3_Hz, A1_L50_8_Hz, A1_L50_10_Hz, A1_L50_12.5_Hz, A1_L50_16_Hz, A1_L50_20_Hz, A1_L50_25_Hz, A1_L50_31.5_Hz, A1_L50_40_Hz, A1_L50_50_Hz, A1_L50_63_Hz, A1_L50_80_Hz, A1_L50_100_Hz, A1_L50_125_Hz, A1_L50_160_Hz, A1_L50_200_Hz, A1_L50_250_Hz, A1_L50_315_Hz, A1_L50_400_Hz, A1_L50_500_Hz, A1_L50_630_Hz, A1_L50_800_Hz, A1_L50_1000_Hz, A1_L50_1250_Hz, A1_L50_1600_Hz, A1_L50_2000_Hz, A1_L50_2500_Hz, A1_L50_3150_Hz, A1_L50_4000_Hz, A1_L50_5000_Hz, A1_L50_6300_Hz, A1_L50_8000_Hz, A1_L50_10000_Hz, A1_L50_12500_Hz, A1_L50_16000_Hz, A1_L50_20000_Hz","A1_L90_Z, A1_L90_A, A1_L90_6.3_Hz, A1_L90_8_Hz, A1_L90_10_Hz, A1_L90_12.5_Hz, A1_L90_16_Hz, A1_L90_20_Hz, A1_L90_25_Hz, A1_L90_31.5_Hz, A1_L90_40_Hz, A1_L90_50_Hz, A1_L90_63_Hz, A1_L90_80_Hz, A1_L90_100_Hz, A1_L90_125_Hz, A1_L90_160_Hz, A1_L90_200_Hz, A1_L90_250_Hz, A1_L90_315_Hz, A1_L90_400_Hz, A1_L90_500_Hz, A1_L90_630_Hz, A1_L90_800_Hz, A1_L90_1000_Hz, A1_L90_1250_Hz, A1_L90_1600_Hz, A1_L90_2000_Hz, A1_L90_2500_Hz, A1_L90_3150_Hz, A1_L90_4000_Hz, A1_L90_5000_Hz, A1_L90_6300_Hz, A1_L90_8000_Hz, A1_L90_10000_Hz, A1_L90_12500_Hz, A1_L90_16000_Hz, A1_L90_20000_Hz","A2_LEQ_Z, A2_LEQ_A, A2_LEQ_6.3_Hz, A2_LEQ_8_Hz, A2_LEQ_10_Hz, A2_LEQ_12.5_Hz, A2_LEQ_16_Hz, A2_LEQ_20_Hz, A2_LEQ_25_Hz, A2_LEQ_31.5_Hz, A2_LEQ_40_Hz, A2_LEQ_50_Hz, A2_LEQ_63_Hz, A2_LEQ_80_Hz, A2_LEQ_100_Hz, A2_LEQ_125_Hz, A2_LEQ_160_Hz, A2_LEQ_200_Hz, A2_LEQ_250_Hz, A2_LEQ_315_Hz, A2_LEQ_400_Hz, A2_LEQ_500_Hz, A2_LEQ_630_Hz, A2_LEQ_800_Hz, A2_LEQ_1000_Hz, A2_LEQ_1250_Hz, A2_LEQ_1600_Hz, A2_LEQ_2000_Hz, A2_LEQ_2500_Hz, A2_LEQ_3150_Hz, A2_LEQ_4000_Hz, A2_LEQ_5000_Hz, A2_LEQ_6300_Hz, A2_LEQ_8000_Hz, A2_LEQ_10000_Hz, A2_LEQ_12500_Hz, A2_LEQ_16000_Hz, A2_LEQ_20000_Hz","A2_L10_Z, A2_L10_A, A2_L10_6.3_Hz, A2_L10_8_Hz, A2_L10_10_Hz, A2_L10_12.5_Hz, A2_L10_16_Hz, A2_L10_20_Hz, A2_L10_25_Hz, A2_L10_31.5_Hz, A2_L10_40_Hz, A2_L10_50_Hz, A2_L10_63_Hz, A2_L10_80_Hz, A2_L10_100_Hz, A2_L10_125_Hz, A2_L10_160_Hz, A2_L10_200_Hz, A2_L10_250_Hz, A2_L10_315_Hz, A2_L10_400_Hz, A2_L10_500_Hz, A2_L10_630_Hz, A2_L10_800_Hz, A2_L10_1000_Hz, A2_L10_1250_Hz, A2_L10_1600_Hz, A2_L10_2000_Hz, A2_L10_2500_Hz, A2_L10_3150_Hz, A2_L10_4000_Hz, A2_L10_5000_Hz, A2_L10_6300_Hz, A2_L10_8000_Hz, A2_L10_10000_Hz, A2_L10_12500_Hz, A2_L10_16000_Hz, A2_L10_20000_Hz","A2_L50_Z, A2_L50_A, A2_L50_6.3_Hz, A2_L50_8_Hz, A2_L50_10_Hz, A2_L50_12.5_Hz, A2_L50_16_Hz, A2_L50_20_Hz, A2_L50_25_Hz, A2_L50_31.5_Hz, A2_L50_40_Hz, A2_L50_50_Hz, A2_L50_63_Hz, A2_L50_80_Hz, A2_L50_100_Hz, A2_L50_125_Hz, A2_L50_160_Hz, A2_L50_200_Hz, A2_L50_250_Hz, A2_L50_315_Hz, A2_L50_400_Hz, A2_L50_500_Hz, A2_L50_630_Hz, A2_L50_800_Hz, A2_L50_1000_Hz, A2_L50_1250_Hz, A2_L50_1600_Hz, A2_L50_2000_Hz, A2_L50_2500_Hz, A2_L50_3150_Hz, A2_L50_4000_Hz, A2_L50_5000_Hz, A2_L50_6300_Hz, A2_L50_8000_Hz, A2_L50_10000_Hz, A2_L50_12500_Hz, A2_L50_16000_Hz, A2_L50_20000_Hz","A2_L90_Z, A2_L90_A, A2_L90_6.3_Hz, A2_L90_8_Hz, A2_L90_10_Hz, A2_L90_12.5_Hz, A2_L90_16_Hz, A2_L90_20_Hz, A2_L90_25_Hz, A2_L90_31.5_Hz, A2_L90_40_Hz, A2_L90_50_Hz, A2_L90_63_Hz, A2_L90_80_Hz, A2_L90_100_Hz, A2_L90_125_Hz, A2_L90_160_Hz, A2_L90_200_Hz, A2_L90_250_Hz, A2_L90_315_Hz, A2_L90_400_Hz, A2_L90_500_Hz, A2_L90_630_Hz, A2_L90_800_Hz, A2_L90_1000_Hz, A2_L90_1250_Hz, A2_L90_1600_Hz, A2_L90_2000_Hz, A2_L90_2500_Hz, A2_L90_3150_Hz, A2_L90_4000_Hz, A2_L90_5000_Hz, A2_L90_6300_Hz, A2_L90_8000_Hz, A2_L90_10000_Hz, A2_L90_12500_Hz, A2_L90_16000_Hz, A2_L90_20000_Hz","A3_LEQ_Z, A3_LEQ_A, A3_LEQ_6.3_Hz, A3_LEQ_8_Hz, A3_LEQ_10_Hz, A3_LEQ_12.5_Hz, A3_LEQ_16_Hz, A3_LEQ_20_Hz, A3_LEQ_25_Hz, A3_LEQ_31.5_Hz, A3_LEQ_40_Hz, A3_LEQ_50_Hz, A3_LEQ_63_Hz, A3_LEQ_80_Hz, A3_LEQ_100_Hz, A3_LEQ_125_Hz, A3_LEQ_160_Hz, A3_LEQ_200_Hz, A3_LEQ_250_Hz, A3_LEQ_315_Hz, A3_LEQ_400_Hz, A3_LEQ_500_Hz, A3_LEQ_630_Hz, A3_LEQ_800_Hz, A3_LEQ_1000_Hz, A3_LEQ_1250_Hz, A3_LEQ_1600_Hz, A3_LEQ_2000_Hz, A3_LEQ_2500_Hz, A3_LEQ_3150_Hz, A3_LEQ_4000_Hz, A3_LEQ_5000_Hz, A3_LEQ_6300_Hz, A3_LEQ_8000_Hz, A3_LEQ_10000_Hz, A3_LEQ_12500_Hz, A3_LEQ_16000_Hz, A3_LEQ_20000_Hz","A3_L10_Z, A3_L10_A, A3_L10_6.3_Hz, A3_L10_8_Hz, A3_L10_10_Hz, A3_L10_12.5_Hz, A3_L10_16_Hz, A3_L10_20_Hz, A3_L10_25_Hz, A3_L10_31.5_Hz, A3_L10_40_Hz, A3_L10_50_Hz, A3_L10_63_Hz, A3_L10_80_Hz, A3_L10_100_Hz, A3_L10_125_Hz, A3_L10_160_Hz, A3_L10_200_Hz, A3_L10_250_Hz, A3_L10_315_Hz, A3_L10_400_Hz, A3_L10_500_Hz, A3_L10_630_Hz, A3_L10_800_Hz, A3_L10_1000_Hz, A3_L10_1250_Hz, A3_L10_1600_Hz, A3_L10_2000_Hz, A3_L10_2500_Hz, A3_L10_3150_Hz, A3_L10_4000_Hz, A3_L10_5000_Hz, A3_L10_6300_Hz, A3_L10_8000_Hz, A3_L10_10000_Hz, A3_L10_12500_Hz, A3_L10_16000_Hz, A3_L10_20000_Hz","A3_L50_Z, A3_L50_A, A3_L50_6.3_Hz, A3_L50_8_Hz, A3_L50_10_Hz, A3_L50_12.5_Hz, A3_L50_16_Hz, A3_L50_20_Hz, A3_L50_25_Hz, A3_L50_31.5_Hz, A3_L50_40_Hz, A3_L50_50_Hz, A3_L50_63_Hz, A3_L50_80_Hz, A3_L50_100_Hz, A3_L50_125_Hz, A3_L50_160_Hz, A3_L50_200_Hz, A3_L50_250_Hz, A3_L50_315_Hz, A3_L50_400_Hz, A3_L50_500_Hz, A3_L50_630_Hz, A3_L50_800_Hz, A3_L50_1000_Hz, A3_L50_1250_Hz, A3_L50_1600_Hz, A3_L50_2000_Hz, A3_L50_2500_Hz, A3_L50_3150_Hz, A3_L50_4000_Hz, A3_L50_5000_Hz, A3_L50_6300_Hz, A3_L50_8000_Hz, A3_L50_10000_Hz, A3_L50_12500_Hz, A3_L50_16000_Hz, A3_L50_20000_Hz","A3_L90_Z, A3_L90_A, A3_L90_6.3_Hz, A3_L90_8_Hz, A3_L90_10_Hz, A3_L90_12.5_Hz, A3_L90_16_Hz, A3_L90_20_Hz, A3_L90_25_Hz, A3_L90_31.5_Hz, A3_L90_40_Hz, A3_L90_50_Hz, A3_L90_63_Hz, A3_L90_80_Hz, A3_L90_100_Hz, A3_L90_125_Hz, A3_L90_160_Hz, A3_L90_200_Hz, A3_L90_250_Hz, A3_L90_315_Hz, A3_L90_400_Hz, A3_L90_500_Hz, A3_L90_630_Hz, A3_L90_800_Hz, A3_L90_1000_Hz, A3_L90_1250_Hz, A3_L90_1600_Hz, A3_L90_2000_Hz, A3_L90_2500_Hz, A3_L90_3150_Hz, A3_L90_4000_Hz, A3_L90_5000_Hz, A3_L90_6300_Hz, A3_L90_8000_Hz, A3_L90_10000_Hz, A3_L90_12500_Hz, A3_L90_16000_Hz, A3_L90_20000_Hz","A4_LEQ_Z, A4_LEQ_A, A4_LEQ_6.3_Hz, A4_LEQ_8_Hz, A4_LEQ_10_Hz, A4_LEQ_12.5_Hz, A4_LEQ_16_Hz, A4_LEQ_20_Hz, A4_LEQ_25_Hz, A4_LEQ_31.5_Hz, A4_LEQ_40_Hz, A4_LEQ_50_Hz, A4_LEQ_63_Hz, A4_LEQ_80_Hz, A4_LEQ_100_Hz, A4_LEQ_125_Hz, A4_LEQ_160_Hz, A4_LEQ_200_Hz, A4_LEQ_250_Hz, A4_LEQ_315_Hz, A4_LEQ_400_Hz, A4_LEQ_500_Hz, A4_LEQ_630_Hz, A4_LEQ_800_Hz, A4_LEQ_1000_Hz, A4_LEQ_1250_Hz, A4_LEQ_1600_Hz, A4_LEQ_2000_Hz, A4_LEQ_2500_Hz, A4_LEQ_3150_Hz, A4_LEQ_4000_Hz, A4_LEQ_5000_Hz, A4_LEQ_6300_Hz, A4_LEQ_8000_Hz, A4_LEQ_10000_Hz, A4_LEQ_12500_Hz, A4_LEQ_16000_Hz, A4_LEQ_20000_Hz","A4_L10_Z, A4_L10_A, A4_L10_6.3_Hz, A4_L10_8_Hz, A4_L10_10_Hz, A4_L10_12.5_Hz, A4_L10_16_Hz, A4_L10_20_Hz, A4_L10_25_Hz, A4_L10_31.5_Hz, A4_L10_40_Hz, A4_L10_50_Hz, A4_L10_63_Hz, A4_L10_80_Hz, A4_L10_100_Hz, A4_L10_125_Hz, A4_L10_160_Hz, A4_L10_200_Hz, A4_L10_250_Hz, A4_L10_315_Hz, A4_L10_400_Hz, A4_L10_500_Hz, A4_L10_630_Hz, A4_L10_800_Hz, A4_L10_1000_Hz, A4_L10_1250_Hz, A4_L10_1600_Hz, A4_L10_2000_Hz, A4_L10_2500_Hz, A4_L10_3150_Hz, A4_L10_4000_Hz, A4_L10_5000_Hz, A4_L10_6300_Hz, A4_L10_8000_Hz, A4_L10_10000_Hz, A4_L10_12500_Hz, A4_L10_16000_Hz, A4_L10_20000_Hz","A4_L50_Z, A4_L50_A, A4_L50_6.3_Hz, A4_L50_8_Hz, A4_L50_10_Hz, A4_L50_12.5_Hz, A4_L50_16_Hz, A4_L50_20_Hz, A4_L50_25_Hz, A4_L50_31.5_Hz, A4_L50_40_Hz, A4_L50_50_Hz, A4_L50_63_Hz, A4_L50_80_Hz, A4_L50_100_Hz, A4_L50_125_Hz, A4_L50_160_Hz, A4_L50_200_Hz, A4_L50_250_Hz, A4_L50_315_Hz, A4_L50_400_Hz, A4_L50_500_Hz, A4_L50_630_Hz, A4_L50_800_Hz, A4_L50_1000_Hz, A4_L50_1250_Hz, A4_L50_1600_Hz, A4_L50_2000_Hz, A4_L50_2500_Hz, A4_L50_3150_Hz, A4_L50_4000_Hz, A4_L50_5000_Hz, A4_L50_6300_Hz, A4_L50_8000_Hz, A4_L50_10000_Hz, A4_L50_12500_Hz, A4_L50_16000_Hz, A4_L50_20000_Hz","A4_L90_Z, A4_L90_A, A4_L90_6.3_Hz, A4_L90_8_Hz, A4_L90_10_Hz, A4_L90_12.5_Hz, A4_L90_16_Hz, A4_L90_20_Hz, A4_L90_25_Hz, A4_L90_31.5_Hz, A4_L90_40_Hz, A4_L90_50_Hz, A4_L90_63_Hz, A4_L90_80_Hz, A4_L90_100_Hz, A4_L90_125_Hz, A4_L90_160_Hz, A4_L90_200_Hz, A4_L90_250_Hz, A4_L90_315_Hz, A4_L90_400_Hz, A4_L90_500_Hz, A4_L90_630_Hz, A4_L90_800_Hz, A4_L90_1000_Hz, A4_L90_1250_Hz, A4_L90_1600_Hz, A4_L90_2000_Hz, A4_L90_2500_Hz, A4_L90_3150_Hz, A4_L90_4000_Hz, A4_L90_5000_Hz, A4_L90_6300_Hz, A4_L90_8000_Hz, A4_L90_10000_Hz, A4_L90_12500_Hz, A4_L90_16000_Hz, A4_L90_20000_Hz","A5_LEQ_Z, A5_LEQ_A, A5_LEQ_6.3_Hz, A5_LEQ_8_Hz, A5_LEQ_10_Hz, A5_LEQ_12.5_Hz, A5_LEQ_16_Hz, A5_LEQ_20_Hz, A5_LEQ_25_Hz, A5_LEQ_31.5_Hz, A5_LEQ_40_Hz, A5_LEQ_50_Hz, A5_LEQ_63_Hz, A5_LEQ_80_Hz, A5_LEQ_100_Hz, A5_LEQ_125_Hz, A5_LEQ_160_Hz, A5_LEQ_200_Hz, A5_LEQ_250_Hz, A5_LEQ_315_Hz, A5_LEQ_400_Hz, A5_LEQ_500_Hz, A5_LEQ_630_Hz, A5_LEQ_800_Hz, A5_LEQ_1000_Hz, A5_LEQ_1250_Hz, A5_LEQ_1600_Hz, A5_LEQ_2000_Hz, A5_LEQ_2500_Hz, A5_LEQ_3150_Hz, A5_LEQ_4000_Hz, A5_LEQ_5000_Hz, A5_LEQ_6300_Hz, A5_LEQ_8000_Hz, A5_LEQ_10000_Hz, A5_LEQ_12500_Hz, A5_LEQ_16000_Hz, A5_LEQ_20000_Hz","A5_L10_Z, A5_L10_A, A5_L10_6.3_Hz, A5_L10_8_Hz, A5_L10_10_Hz, A5_L10_12.5_Hz, A5_L10_16_Hz, A5_L10_20_Hz, A5_L10_25_Hz, A5_L10_31.5_Hz, A5_L10_40_Hz, A5_L10_50_Hz, A5_L10_63_Hz, A5_L10_80_Hz, A5_L10_100_Hz, A5_L10_125_Hz, A5_L10_160_Hz, A5_L10_200_Hz, A5_L10_250_Hz, A5_L10_315_Hz, A5_L10_400_Hz, A5_L10_500_Hz, A5_L10_630_Hz, A5_L10_800_Hz, A5_L10_1000_Hz, A5_L10_1250_Hz, A5_L10_1600_Hz, A5_L10_2000_Hz, A5_L10_2500_Hz, A5_L10_3150_Hz, A5_L10_4000_Hz, A5_L10_5000_Hz, A5_L10_6300_Hz, A5_L10_8000_Hz, A5_L10_10000_Hz, A5_L10_12500_Hz, A5_L10_16000_Hz, A5_L10_20000_Hz","A5_L50_Z, A5_L50_A, A5_L50_6.3_Hz, A5_L50_8_Hz, A5_L50_10_Hz, A5_L50_12.5_Hz, A5_L50_16_Hz, A5_L50_20_Hz, A5_L50_25_Hz, A5_L50_31.5_Hz, A5_L50_40_Hz, A5_L50_50_Hz, A5_L50_63_Hz, A5_L50_80_Hz, A5_L50_100_Hz, A5_L50_125_Hz, A5_L50_160_Hz, A5_L50_200_Hz, A5_L50_250_Hz, A5_L50_315_Hz, A5_L50_400_Hz, A5_L50_500_Hz, A5_L50_630_Hz, A5_L50_800_Hz, A5_L50_1000_Hz, A5_L50_1250_Hz, A5_L50_1600_Hz, A5_L50_2000_Hz, A5_L50_2500_Hz, A5_L50_3150_Hz, A5_L50_4000_Hz, A5_L50_5000_Hz, A5_L50_6300_Hz, A5_L50_8000_Hz, A5_L50_10000_Hz, A5_L50_12500_Hz, A5_L50_16000_Hz, A5_L50_20000_Hz","A5_L90_Z, A5_L90_A, A5_L90_6.3_Hz, A5_L90_8_Hz, A5_L90_10_Hz, A5_L90_12.5_Hz, A5_L90_16_Hz, A5_L90_20_Hz, A5_L90_25_Hz, A5_L90_31.5_Hz, A5_L90_40_Hz, A5_L90_50_Hz, A5_L90_63_Hz, A5_L90_80_Hz, A5_L90_100_Hz, A5_L90_125_Hz, A5_L90_160_Hz, A5_L90_200_Hz, A5_L90_250_Hz, A5_L90_315_Hz, A5_L90_400_Hz, A5_L90_500_Hz, A5_L90_630_Hz, A5_L90_800_Hz, A5_L90_1000_Hz, A5_L90_1250_Hz, A5_L90_1600_Hz, A5_L90_2000_Hz, A5_L90_2500_Hz, A5_L90_3150_Hz, A5_L90_4000_Hz, A5_L90_5000_Hz, A5_L90_6300_Hz, A5_L90_8000_Hz, A5_L90_10000_Hz, A5_L90_12500_Hz, A5_L90_16000_Hz, A5_L90_20000_Hz"
"hauteur (m)","6, 20, 60, 78","70, 80","35, 75, 80","6, 20, 60, 78",6,6,10,10,10,10,10,10,10,10,10,10,10,10,10,10,50,50,50,50,50,50,50,50,50,50,50,50,50,50,80,80,80,80,80,80,80,80,80,80,80,80,80,80,1,1,1,1,1,"10, 19, 38, 39, 54, 69, 84, 99, 114, 129, 144, 164, 184","10, 19, 38, 39, 54, 69, 84, 99, 114, 129, 144, 164, 184","10, 19, 38, 39, 54, 69, 84, 99, 114, 129, 144, 164, 184","1.5","1.5","1.5","1.5","2.6","2.6","2.6","2.6","1.5","1.5","1.5","1.5","1.5","1.5","1.5","1.5","1.5","1.5","1.5","1.5"
"coord. GPS ","48.222243, 1.525669 (48°13'20.1""N 1°31'32.4""E)","48.222243, 1.525669 (48°13'20.1""N 1°31'32.4""E)","48.222243, 1.525669 (48°13'20.1""N 1°31'32.4""E)","48.222243, 1.525669 (48°13'20.1""N 1°31'32.4""E)","48.222243, 1.525669 (48°13'20.1""N 1°31'32.4""E)","48.222243, 1.525669 (48°13'20.1""N 1°31'32.4""E)","48.2214722, 1.525278 (48°13'17.3""N 1°31'31.0""E)","48.2214722, 1.525278 (48°13'17.3""N 1°31'31.0""E)","48.2214722, 1.525278 (48°13'17.3""N 1°31'31.0""E)","48.2214722, 1.525278 (48°13'17.3""N 1°31'31.0""E)","48.2214722, 1.525278 (48°13'17.3""N 1°31'31.0""E)","48.2214722, 1.525278 (48°13'17.3""N 1°31'31.0""E)","48.2214722, 1.525278 (48°13'17.3""N 1°31'31.0""E)","48.2214722, 1.525278 (48°13'17.3""N 1°31'31.0""E)","48.2214722, 1.525278 (48°13'17.3""N 1°31'31.0""E)","48.2214722, 1.525278 (48°13'17.3""N 1°31'31.0""E)","48.2214722, 1.525278 (48°13'17.3""N 1°31'31.0""E)","48.2214722, 1.525278 (48°13'17.3""N 1°31'31.0""E)","48.2214722, 1.525278 (48°13'17.3""N 1°31'31.0""E)","48.2214722, 1.525278 (48°13'17.3""N 1°31'31.0""E)","48.2246333, 1.535061 (48°13'28.68""N 1°32'6.22""E)","48.2246333, 1.535061 (48°13'28.68""N 1°32'6.22""E)","48.2246333, 1.535061 (48°13'28.68""N 1°32'6.22""E)","48.2246333, 1.535061 (48°13'28.68""N 1°32'6.22""E)","48.2246333, 1.535061 (48°13'28.68""N 1°32'6.22""E)","48.2246333, 1.535061 (48°13'28.68""N 1°32'6.22""E)","48.2246333, 1.535061 (48°13'28.68""N 1°32'6.22""E)","48.2246333, 1.535061 (48°13'28.68""N 1°32'6.22""E)","48.2246333, 1.535061 (48°13'28.68""N 1°32'6.22""E)","48.2246333, 1.535061 (48°13'28.68""N 1°32'6.22""E)","48.2246333, 1.535061 (48°13'28.68""N 1°32'6.22""E)","48.2246333, 1.535061 (48°13'28.68""N 1°32'6.22""E)","48.2246333, 1.535061 (48°13'28.68""N 1°32'6.22""E)","48.2246333, 1.535061 (48°13'28.68""N 1°32'6.22""E)","48.2284167, 1.5351805555555553 (48°13'42.3""N 1°32'6.65""E)","48.2284167, 1.5351805555555553 (48°13'42.3""N 1°32'6.65""E)","48.2284167, 1.5351805555555553 (48°13'42.3""N 1°32'6.65""E)","48.2284167, 1.5351805555555553 (48°13'42.3""N 1°32'6.65""E)","48.2284167, 1.5351805555555553 (48°13'42.3""N 1°32'6.65""E)","48.2284167, 1.5351805555555553 (48°13'42.3""N 1°32'6.65""E)","48.2284167, 1.5351805555555553 (48°13'42.3""N 1°32'6.65""E)","48.2284167, 1.5351805555555553 (48°13'42.3""N 1°32'6.65""E)","48.2284167, 1.5351805555555553 (48°13'42.3""N 1°32'6.65""E)","48.2284167, 1.5351805555555553 (48°13'42.3""N 1°32'6.65""E)","48.2284167, 1.5351805555555553 (48°13'42.3""N 1°32'6.65""E)","48.2284167, 1.5351805555555553 (48°13'42.3""N 1°32'6.65""E)","48.2284167, 1.5351805555555553 (48°13'42.3""N 1°32'6.65""E)","48.2284167, 1.5351805555555553 (48°13'42.3""N 1°32'6.65""E)","48.22224, 1.52545 (48°13'20.064''N 1°31'31.619''E)","48.22224, 1.52545 (48°13'20.064''N 1°31'31.619''E)","48.22224, 1.52545 (48°13'20.064''N 1°31'31.619''E)","48.22224, 1.52545 (48°13'20.064''N 1°31'31.619''E)","48.22224, 1.52545 (48°13'20.064''N 1°31'31.619''E)","48.22224, 1.52545 (48°13'20.064''N 1°31'31.619''E)","48.22224, 1.52545 (48°13'20.064''N 1°31'31.619''E)","48.22224, 1.52545 (48°13'20.064''N 1°31'31.619''E)","48.2223, 1.5256 (48°13’20.28N 1°31’32.16’’E)","48.2223, 1.5256 (48°13’20.28N 1°31’32.16’’E)","48.2223, 1.5256 (48°13’20.28N 1°31’32.16’’E)","48.2223, 1.5256 (48°13’20.28N 1°31’32.16’’E)","48.2311, 1.5307 (48°13’51.96N 1°31’50.519’’E)","48.2311, 1.5307 (48°13’51.96N 1°31’50.519’’E)","48.2311, 1.5307 (48°13’51.96N 1°31’50.519’’E)","48.2311, 1.5307 (48°13’51.96N 1°31’50.519’’E)","48.2308, 1.5474 (48°13’50.88N 1°32’50.64’’E)","48.2308, 1.5474 (48°13’50.88N 1°32’50.64’’E)","48.2308, 1.5474 (48°13’50.88N 1°32’50.64’’E)","48.2308, 1.5474 (48°13’50.88N 1°32’50.64’’E)","48.2096, 1.5394 (48°12’34.56N 1°32’21.84’’E)","48.2096, 1.5394 (48°12’34.56N 1°32’21.84’’E)","48.2096, 1.5394 (48°12’34.56N 1°32’21.84’’E)","48.2096, 1.5394 (48°12’34.56N 1°32’21.84’’E)","48.2141, 1.5188 (48°12’50.76N 1°31’7.679’’E)","48.2141, 1.5188 (48°12’50.76N 1°31’7.679’’E)","48.2141, 1.5188 (48°12’50.76N 1°31’7.679’’E)","48.2141, 1.5188 (48°12’50.76N 1°31’7.679’’E)"
"type ","VAISALA","VAISALA","VAISALA","VAISALA","VAISALA","VAISALA","Young","Young","Young","Young","Young","Young","Young","Young","Young","Young","Young","Young","Young","Young","Young","Young","Young","Young","Young","Young","Young","Young","Young","Young","Young","Young","Young","Young","Young 3","Young 3","Young 3","Young 3","Young 3","Young 3","Young 3","Young 3","Young 3","Young 3","Young 3","Young 3","Young 3","Young 3","ZXLidars","ZXLidars","ZXLidars","ZXLidars","ZXLidars","ZXLidars","ZXLidars","ZXLidars","01dB","01dB","01dB","01dB","01dB","01dB","01dB","01dB","01dB","01dB","01dB","01dB","01dB","01dB","01dB","01dB","01dB","01dB","01dB","01dB"
"modèle","HMP45D","DTR503A","DTR503A","DTR503A","DTR503A","DTR503A","C_Sonic","C_Sonic","C_Sonic","C_Sonic","C_Sonic","C_Sonic","C_Sonic","C_Sonic","C_Sonic","C_Sonic","C_Sonic","C_Sonic","C_Sonic","C_Sonic","I_Sonic","I_Sonic","I_Sonic","I_Sonic","I_Sonic","I_Sonic","I_Sonic","I_Sonic","I_Sonic","I_Sonic","I_Sonic","I_Sonic","I_Sonic","I_Sonic","Young 3","Young 3","Young 3","Young 3","Young 3","Young 3","Young 3","Young 3","Young 3","Young 3","Young 3","Young 3","Young 3","Young 3","ZX 300","ZX 300","ZX 300","ZX 300","ZX 300","ZX 300","ZX 300","ZX 300","DUO","DUO","DUO","DUO","DUO","DUO","DUO","DUO","DUO","DUO","DUO","DUO","DUO","DUO","DUO","DUO","DUO","DUO","DUO","DUO"
